Workout Name,Description,Category,Athlete,Thumbnail
Trey Burke Beginner Pre-Game Workout ,Trey Burke Beginner Pre-Game Workout ,Hip Hop Handles,Trey Burke,trey-burke.jpg
Trey Burke Advanced Triple-Move Rhythm Workout,Trey Burke Advanced Triple-Move Rhythm Workout,Hip Hop Handles,Trey Burke,trey-burke.jpg
Jordan Sibert Beginner Steady Tempo Workout,Jordan Sibert Beginner Steady Tempo Workout,Hip Hop Handles,Jordan Sibert,jordan-sibert.jpg
Jordan Sibert Advanced Lateral Isolation Workout,Jordan Sibert Advanced Lateral Isolation Workout,Hip Hop Handles,Jordan Sibert,jordan-sibert.jpg
Brandon Tate Beginner Ladder Workout,Brandon Tate Beginner Ladder Workout,Sweet Feet Footwork,Brandon Tate,brandon-tate.jpg
Tony Johnson Advanced Lead Jab Combo Workout,Tony Johnson Advanced Lead Jab Combo Workout,Beat Boxing,Tony Johnson,tony-johnson.jpg
Tony Johnson Advacned Lead Cross-body Combo Workout,Tony Johnson Advacned Lead Cross-body Combo Workout,Beat Boxing,Tony Johnson,tony-johnson.jpg
Tony Johnson Expert Heavy Bag Workout,Tony Johnson Expert Heavy Bag Workout,Beat Boxing,Tony Johnson,tony-johnson.jpg
